{
  "id": "evi-2025-08-19-0001",
  "title": "週次ドリフト検知（dev-foundation）",
  "controls": [
    "CM-2",
    "ORG-OPS-02"
  ],
  "framework": "NIST_800_53_R5",
  "produced_at": "2025-08-19T01:02:03Z",
  "produced_by": {
    "actor": "GitHub Actions",
    "system": "drift.yml",
    "run_id": "1234567890",
    "commit_sha": "deadbeef"
  },
  "environment": "Dev",
  "artifacts": [
    "2025-08-19_drift-dev-foundation.txt"
  ],
  "hashes": {
    "2025-08-19_drift-dev-foundation.txt": "sha256:PLACEHOLDER"
  },
  "retention_until": null,
  "notes": "差分なし（exit-code=0）",
  "review": {
    "status": "accepted",
    "reviewer": "alice",
    "reviewed_at": "2025-08-19T02:00:00Z"
  }
}
